"","language_a","language_b","a_text","b_text","sentence_length_b","sentence_length_a"
"3446","es","en","Prepandrix, suspensión y emulsión para emulsión inyectable Vacuna antigripal prepandémica (H5N1) (de virus fraccionados, inactivados, adyuvada)","Prepandrix suspension and emulsion for emulsion for injection Prepandemic influenza vaccine (H5N1) (split virion, inactivated, adjuvanted)",16,16
"3447","es","en","Preparación para eliminar el aire","Priming to expel air",4,5
"3448","es","en","Preparar el lugar de inyección e inyectar la solución de Enbrel h.","Preparing the injection site and injecting the Enbrel solution h.",10,12
"3449","es","en","Prepare la dosis: • Retire la tapa que cubre la parte superior del vial.","Prepare the dose: • Take the cap off the top of the vial",13,14
"3450","es","en","Presentación Cajas con 7, 14, 28, 56, 84 ó 100 sobres.","Pack sizes Boxes containing 7, 14, 28, 56, 84 or 100 sachets.",12,11
"3451","es","en","PRESENTACIÓN EN VIAL DE 3,5 ML","VIAL 3.5 ML PRESENTATION",4,6
"3452","es","en","Presentado como un spray volátil, este medicamento veterinario no requiere masaje.","Presented as a volatile spray, this veterinary medicinal product does not require any massage.",14,11
"3453","es","en","Presentan selectividad por los interferones humanos pero no por los murinos, lo que sugiere una especificidad de especie.","They exhibit selectivity for human but not murine interferons, suggesting species specificity.",12,18
"3454","es","en","Presentó alegaciones verbales el 18 de enero de 2005.","Oral explanation was given by the Marketing Authorisation Holder on 18 January 2005.",13,9
"3455","es","en","presión arterial durante el tratamiento con etoricoxib.","during treatment with etoricoxib.",4,7
"3456","es","en","presión arterial, ya que la dosis puede tener que ajustarse.","blood pressure, because the dose may need to be adjusted.",10,10
"3457","es","en","Presione brevemente el botón rojo y suéltelo. n co","Briefly press and release red button.",6,9
"3458","es","en","Prevention of invasive infections due to Vancomycin resistant enterococci","Prevention of invasive infections due to Vancomycin resistant",8,9
"3459","es","en","Previcox no debe administrarse conjuntamente con corticosteroides u otros AINE.","Previcox must not be administered with corticosteroids or other NSAIDs.",10,10
"3460","es","en","PREZISTA 600 mg comprimidos recubiertos con película darunavir","PREZISTA 600 mg film-coated tablets darunavir",6,8
"3461","es","en","PRILACTONE 80 mg comprimidos Espironolactona","PRILACTONE 80 mg tablets Spironolactone",5,5
"3462","es","en","Principio activo Mavacoxib Mavacoxib Mavacoxib Mavacoxib Mavacoxib","Mavacoxib Mavacoxib Mavacoxib Mavacoxib Mavacoxib",5,7
"3463","es","en","Principios activos que pueden aumentar las concentraciones plasmáticas de imatinib:","Active substances that may increase imatinib plasma concentrations:",8,10
"3464","es","en","Pritor 80 mg comprimidos telmisartán","Pritor 80 mg tablets telmisartan",5,5
"3465","es","en","Privigen también puede reducir los síntomas de algunos trastornos inflamatorios.","Privigen can also reduce the symptoms in certain inflammatory disorders.",10,10
"3466","es","en","Procedimiento para la eliminación correcta","Procedure for proper disposal",4,5
"3467","es","en","Procoralan 5 mg comprimidos recubiertos con película Procoralan 7,5 mg comprimidos recubiertos con película ivabradina","Procoralan 5 mg film-coated tablets Procoralan 7.5 mg film-coated tablets ivabradine",11,15
"3468","es","en","Procure dirigir el chorro del líquido hacia la pared de vidrio y así evitar la formación de espuma.","Aim the stream of liquid against the glass wall in order to avoid foam.",14,18
"3469","es","en","producción de la EMEA.","task of the EMEA.",4,4
"3470","es","en","Producido por tecnología del ADN recombinante en células de levadura (Saccharomyces cerevisiae) 4","Produced in yeast cells (Saccharomyces cerevisiae) by recombinant DNA technology 4",11,13
"3471","es","en","Profender para gatos grandes (> 5 – 8 kg)","Profender for Large Cats (> 5 – 8 kg)",9,9
"3472","es","en","Profilaxis de rechazo agudo en transplantes renales","L04A Prophylaxis of acute rejection in renal transplantation",8,7
"3473","es","en","PROHIBICIÓN DE VENTA, DISPENSACIÓN Y/ O USO","PROHIBITION OF SALE, SUPPLY AND/ OR USE",7,7
"3474","es","en","Prolongación del intervalo QTc: algunos azoles se han relacionado con una prolongación del intervalo QTc.","Some azoles have been associated with prolongation of the QTc interval.",11,15
"3475","es","en","ProMeris 160 mg Solución Spot-on para gatos pequeños ProMeris 320 mg Solución Spot-on para gatos grandes","ProMeris 160 mg Spot-on solution for small cats ProMeris 320 mg Spot-on solution for large cats",16,16
"3476","es","en","Prometax 3,0 mg [únicamente en la caja]","Prometax 3.0 mg [folding box only]",6,7
"3477","es","en","Prometax Prometax Prometax Prometax Prometax","Prometax Prometax Prometax Prometax Prometax",5,5
"3478","es","en","ProQuad – Polvo en vial y disolvente en jeringa precargada sin aguja- Envase de 1, 10, 20","ProQuad - Powder in vial and solvent in pre-filled syringe without needle - Pack of 1, 10, 20",18,17
"3479","es","en","PROSPECTO Profender solución para unción dorsal puntual para gatos","PACKAGE LEAFLET Profender spot-on solution for cats",7,9
"3480","es","en","ProStrakan Ltd, Galabank Business Park, Galashiels TD1 1QH Reino Unido","ProStrakan Ltd, Galabank Business Galashiels TD1 1QH UK",8,10
"3481","es","en","Protaphane es un análogo de la insulina idéntico a la insulina fabricada por el páncreas.","Protaphane is a replacement insulin which identical to the insulin made by the pancreas.",14,15
"3482","es","en","Protaphane Penfill 100 UI/ ml suspensión inyectable en un cartucho Insulina humana (ADNr)","Protaphane Penfill 100 IU/ ml suspension for injection in a cartridge Insulin human (rDNA)",14,13
"3483","es","en","Protector exterior grande de la aguja","Big outer needle cap",4,6
"3484","es","en","Proteger de la congelación y las altas temperaturas","Avoid freezing or excessive temperatures.",5,8
"3485","es","en","Proteger de la luz.","Protect from light. ng lo 12.",6,4
"3486","es","en","proteínas (carnes, pescados, lácteos, cereales y frutos secos) o poco después de ingerirlos.","protein-rich food (such as meats, fish, dairy products, seeds and nuts).",11,13
"3487","es","en","ProteqFlu-Te Suspensión inyectable para caballos","ProteqFlu-Te Suspension for injection for horses",6,5
"3488","es","en","Protopic contiene tacrolimus como principio activo, un inhibidor de la calcineurina.","Protopic contains the active substance tacrolimus, a calcineurin inhibitor.",9,11
"3489","es","en","Protopy contiene tacrolimus como principio activo, un inhibidor de la calcineurina.","Protopy contains the active substance tacrolimus, a calcineurin inhibitor.",9,11
"3490","es","en","PRT Av. da Siderurgia Nacional S.","PRT Av. da Siderurgia Nacional S.",6,6
"3491","es","en","Pruban es una crema blanca o blanquecina cuyo principio activo es el butirato de resocortol, un corticosteroide.","Resocortol butyrate is a corticosteroid.",5,17
"3492","es","en","Przemysł owa 2 35-959 Rzeszów Polonia","Przemysł owa 2 35-959 Rzeszów Poland",6,6
"3493","es","en","Publicado para consulta en julio de 2001","Released for consultation July 2001",5,7
"3494","es","en","Publicado para consulta en noviembre de 2002","Released for consultation November 2002",5,7
"3495","es","en","Publicado para consulta en septiembre de 2002","Released for consultation February 2002",5,7
"3496","es","en","Puede administrarse con o sin alimentos.","It can be taken with or without food.",8,6
"3497","es","en","puede conllevar a una insuficiencia hepática que ponga en peligro su vida (ver sección 4 Posibles efectos adversos).","life-threatening liver failure (see section 4.",6,18
"3498","es","en","Puede conservar su Humalog KwikPen en uso hasta 28 días a la temperatura ambiente (inferior a 30°C).","Keep your Humalog KwikPen in use at room temperature (below 30°C) for up to 28 days.",16,17
"3499","es","en","Puede experimentar también inflamación del riñón, aumento de orina y sensación de sed.","You may also experience inflammation of the kidney, passing a lot of urine and feeling thirsty.",16,13
"3500","es","en","Puede incrementarse la dosis según los requerimientos individuales hasta un máximo de 90 mg una vez al día.","The dosage can be increased according to individual requirements up to a maximum of 90 mg once-daily.",17,18
"3501","es","en","Puede ocurrir que la insulina que inyecte en ese lugar no actúe bien.","Insulin that you inject in such a site may not work very well.",13,13
"3502","es","en","Puede perjudicarles, aun cuando sus síntomas sean los mismos que los suyos.","It may harm them, even if their symptoms are the same as yours.",13,12
"3503","es","en","Puede prescribirse durante la gestación.","Can be used during pregnancy.",5,5
"3504","es","en","Puede producir irritación de la mucosa nasal.","It may cause irritation of the nasal mucosa.",8,7
"3505","es","en","Puede producirse redistribución, acumulación o pérdida de grasa corporal en pacientes que están recibiendo tratamiento antirretroviral combinado.","Redistribution, accumulation or loss of body fat may occur in patients receiving combination antiretroviral therapy.",15,17
"3506","es","en","Puede producirse somnolencia cuando le administren ZYPREXA.","If this happens do not drive or operate any tools or machines.",12,7
"3507","es","en","Puede producirse somnolencia y aturdimiento, lo que puede afectar a la capacidad para conducir y utilizar máquinas.","Drowsiness and dizziness can sometimes occur and may affect the ability to drive and use machines.",16,17
"3508","es","en","Puede que el médico le recomiende utilizar Humalog además de una insulina de acción más prolongada.","Your doctor may tell you to use Humalog as well as a longer-acting insulin.",14,16
"3509","es","en","Puede que necesite un ajuste de la dosis o que cambie alguno de los medicamentos que está tomando.","You may need to have the dose adjusted or change the other medicines you are taking.",16,18
"3510","es","en","Puede que solamente estén comercializados algunos tamaños de envase.","Not all pack sizes may be marketed in your country.",10,9
"3511","es","en","Puede que solamente estén comercializados algunos tamaños de envases.","Not all pack sizes are marketed.",6,9
"3512","es","en","Puede requerir atención médica.","You may require medical attention.",5,4
"3513","es","en","Puede sentarse, estar de pie o caminar - simplemente permanezca en posición erguida.","You can sit, stand or walk – just stay fully upright.",11,13
"3514","es","en","Puede ser necesario ajustar la dosis del antihipertensivo.","Dosage adjustment of the antihypertensive agent may be required.",9,8
"3515","es","en","Puede ser necesario posponer la vacunación hasta que se haya recuperado.","It might be necessary to postpone the vaccination until recovery.",10,11
"3516","es","en","Puede ser necesario un aumento de la dosis de pioglitazona, cuando se coadministre con rifampicina.","The pioglitazone dose may need to be increased when rifampicin is concomitantly administered.",13,15
"3517","es","en","Puede ser necesario un aumento de la dosis del probenecid o de la sulfinpirazona.","Increase in dosage of probenecid or sulfinpyrazone may be necessary.",10,14
"3518","es","en","Puede ser signo de un ataque cerebral.","These may be signs of a stroke.",7,7
"3519","es","en","Puede ser utilizada durante la gestación y la lactancia.","Can be used during pregnancy and lactation.",7,9
"3520","es","en","Puede sufrir una hipoglucemia si su nivel de azúcar en sangre es demasiado bajo.","A hypo means your blood sugar level is too low.",10,14
"3521","es","en","Puede tener una infección gástrica causada por la bacteria Helicobacter pylori.","You may have a gastric infection caused by a bacterium called Helicobacter pylori.",13,11
"3522","es","en","Puede tomar Oprymea con o sin alimentos.","Oprymea can be taken with or without food.",8,7
"3523","es","en","Puede tomar Vimpat con o sin alimentos.","You may take Vimpat with or without food.",8,7
"3524","es","en","Puede tratarse de personas que han nacido con una carencia de anticuerpos (síndrome de inmunodeficiencia primaria IDP).","These can be people who are born with a lack of antibodies (primary immunodeficiency syndrome, PID).",16,17
"3525","es","en","Puede uto comentar esto con su médico.","This can be discussed with your doctor.",7,7
"3526","es","en","Puede volver a utilizar de forma gradual una luz normal en interiores.","You can gradually return to normal indoor lighting.",8,12
"3527","es","en","Pueden ocurrir muy raramente reacciones alérgicas, incluyendo reacciones anafilactoides.","Allergic reactions, including anaphylactoid reactions, may occur very rarely.",9,9
"3528","es","en","Pueden producir casos de hipotiroidismo y/ o alteraciones del control del hipotiroidismo.","Cases of hypothyroidism and/ or reduced control of hypothyroidism may occur.",11,12
"3529","es","en","Pueden ser hasta 6 periodos (ciclos) de tratamiento.","There may be up to 6 treatment periods (cycles).",9,8
"3530","es","en","Puesto que AZOPT se absorbe sistémicamente, estos efectos pueden presentarse tras su administración oftálmica.","AZOPT is absorbed systemically and therefore this may occur with topical administration.",12,14
"3531","es","en","Punto de contacto Barbara FREISCHEM Teléfono directo (44-20) 74 18 85 81 E-mail: barbara.freischem@emea.eudra.org","Contact point Barbara FREISCHEM Direct telephone (44-20) 74 18 85 81 E-mail: barbara.freischem@emea.eudra.org",13,14
"3532","es","en","Punto de contacto Noël WATHION Teléfono directo (44-20) 74 18 85 92 E-mail: noel. wathion@emea. eudra. org","Contact points Jonna SUNELL-HUET Direct telephone (44-20) 74 18 84 65 E-mail: certificate@emea.eudra.org",13,17
"3533","es","en","Puntuación Apache II ≤ 20 Puntuación Apache II > 20","Apache II score ≤ 20 Apache II score > 20",10,10
"3534","es","en","Puregon 150 UI/ 0,5 ml solución inyectable","Puregon 150 IU/ 0.5 ml solution for injection",8,7
"3535","es","en","Puregon 600 UI/ 0,72 ml solución inyectable folitropina beta","Puregon 600 IU/ 0.72 ml solution for injection follitropin beta",10,9
"3536","es","en","Puregon solución inyectable contiene folitropina beta, una hormona conocida como hormona estimulante del folículo (FSH).","Puregon solution for injection contains follitropin beta, a hormone known as follicle-stimulating hormone (FSH).",14,15
"3537","es","en","Purevax RCP es una vacuna.","Purevax RCP is a vaccine.",5,5
"3538","es","en","purgar el aire atrapado dentro de la jeringa.","water for injections should be drawn into the syringe, making sure to purge any air within the syringe.",18,8
"3539","es","en","Purves trabajó en la industria farmacéutica.","From 1972 to 1974, Dr Purves worked in the pharmaceutical industry.",11,6
"3540","es","en","Pylori puede ocasionar resultados falsos negativos.","Suppression of H. pylori might give false negative results.",9,6
"3541","es","en","QD con ritonavir 100 mg QD)","ritonavir 100 mg QD)",4,6
"3542","es","en","Quadrisol 100 mg/ ml puede utilizarse durante la gestación.","Quadrisol 100 mg/ ml can be used during pregnancy.",9,9
"3543","es","en","Quality of modified release dosage forms for veterinary use","Quality of modified release dosage forms for veterinary use Released for consultation July 2002",14,9
"3544","es","en","que aparecen listados al final de este prospecto.","at the end of this leaflet.",6,8
"3545","es","en","QUÉ ES [DENOMINACIÓN DE FANTASÍA] 400 mg comprimidos recubiertos con película Y PARA QUÉ SE UTILIZA","WHAT [INVENTED NAME] 400 MG FILM-COATED TABLETS ARE AND WHAT THEY ARE USED FOR",14,16
"3546","es","en","Qué es Aclasta y para qué se utiliza 2.","What Aclasta is and what it is used for 2.",10,9
"3547","es","en","QUÉ ES AZOMYR Y PARA QUÉ SE UTILIZA","WHAT AZOMYR IS AND WHAT IT IS USED FOR",9,8
"3548","es","en","Qué es BeneFIX y para qué se utiliza 2.","What BeneFIX is and what it is used for 2.",10,9
"3549","es","en","Qué es Ceftriaxona Tyrol Pharma 2 g y para qué se utiliza","What Ceftriaxone Tyrol Pharma 2g is and what it is used for",12,12
"3550","es","en","QUÉ ES CETROTIDE Y PARA QUÉ SE UTILIZA","WHAT CETROTIDE IS AND WHAT IT IS USED FOR",9,8
"3551","es","en","Qué es CRIXIVAN y para qué se utiliza 2.","What CRIXIVAN is and what it is used for 2.",10,9
"3552","es","en","QUÉ ES ECALTA Y PARA QUÉ SE UTILIZA","WHAT ECALTA IS AND WHAT IT IS USED FOR",9,8
"3553","es","en","QUÉ ES EVOLTRA Y PARA QUÉ SE UTILIZA","WHAT EVOLTRA IS AND WHAT IT IS USED FOR",9,8
"3554","es","en","Qué es Fareston y para qué se utiliza 2.","What Fareston is and what it is used for 2.",10,9
"3555","es","en","QUÉ ES GANFORT Y PARA QUÉ SE UTILIZA","WHAT GANFORT IS AND WHAT IT IS USED FOR",9,8
"3556","es","en","Qué es Helixate NexGen 500 UI y para qué se utiliza 2.","What Helixate NexGen 500 IU is and what it is used for 2.",13,12
"3557","es","en","QUE ES HEXAVAC Y PARA QUÉ SE UTILIZA","WHAT IS HEXAVAC AND WHAT IT IS USED FOR",9,8
"3558","es","en","Qué es Humalog Mix25 y para qué se utiliza 2.","What Humalog Mix25 is and what it is used for 2.",11,10
"3559","es","en","Qué es Insulin Human Winthrop Comb 15 y para qué se utiliza 2.","What Insulin Human Winthrop Comb 15 is and what it is used for 2.",14,13
"3560","es","en","QUÉ ES JALRA Y PARA QUÉ SE UTILIZA","WHAT JALRA IS AND WHAT IT IS USED FOR",9,8
"3561","es","en","QUÉ ES LEVITRA Y PARA QUÉ SE UTILIZA","WHAT LEVITRA IS AND WHAT IT IS USED FOR",9,8
"3562","es","en","QUÉ ES LYSODREN Y PARA QUÉ SE UTILIZA","WHAT LYSODREN IS AND WHAT IT IS USED FOR",9,8
"3563","es","en","Qué es Mimpara y para qué se utiliza 2.","What Mimpara is and what it is used for 2.",10,9
"3564","es","en","Qué es Neulasta y para qué se utiliza 2.","What Neulasta is and what it is used for 2.",10,9
"3565","es","en","QUÉ ES OLANZAPINA TEVA Y PARA QUÉ SE UTILIZA","WHAT OLANZAPINE TEVA IS AND WHAT IT IS USED FOR",10,9
"3566","es","en","QUÉ ES ORACEA Y PARA QUÉ SE UTILIZA","WHAT ORACEA IS AND WHAT IT IS USED FOR",9,8
"3567","es","en","Qué es PritorPlus y para qué se utiliza 2.","What PritorPlus is and what it is used for 2.",10,9
"3568","es","en","Qué es REGRANEX y para qué se utiliza 2.","What REGRANEX is and what it is used for 2.",10,9
"3569","es","en","QUÉ ES SERETIDE Y PARA QUÉ SE UTILIZA","WHAT SERETIDE IS AND WHAT IT IS USED FOR",9,8
"3570","es","en","Qué es Sonata y para qué se utiliza 2.","What Sonata is and what it is used for 2.",10,9
"3571","es","en","QUÉ ES SUSTIVA Y PARA QUÉ SE UTILIZA","WHAT SUSTIVA IS AND WHAT IT IS USED FOR",9,8
"3572","es","en","Qué es Tasigna Tasigna es un medicamento que contiene un principio activo denominado nilotinib.","What Tasigna is Tasigna is a medicine containing an active substance called nilotinib.",13,14
"3573","es","en","Qué es Tevagrastim Tevagrastim contiene el principio activo filgrastim.","What Tevagrastim is Tevagrastim contains the active substance filgrastim.",9,9
"3574","es","en","Qué es TRACTOCILE y para qué se utiliza 2.","What TRACTOCILE is and what it is used for 2.",10,9
"3575","es","en","QUÉ ES TWINRIX ADULTOS Y PARA QUÉ SE UTILIZA","WHAT TWINRIX ADULT IS AND WHAT IT IS USED FOR",10,9
"3576","es","en","QUÉ ES VELMETIA Y PARA QUÉ SE UTILIZA","WHAT VELMETIA IS AND WHAT IT IS USED FOR",9,8
"3577","es","en","Qué es VIRACEPT y para qué se utiliza 2.","What VIRACEPT is and what it is used for 2.",10,9
"3578","es","en","Qué es Volibris y para qué se utiliza 2.","What Volibris is and what it is used for 2.",10,9
"3579","es","en","Qué es Xeomin y para qué se utiliza 2.","What Xeomin is and what it is used for 2.",10,9
"3580","es","en","QUÉ ES ZIAGEN Y PARA QUÉ SE UTILIZA","WHAT ZIAGEN IS AND WHAT IT IS USED FOR",9,8
"3581","es","en","QUÉ ES ZYRTEC Y PARA QUÉ SE UTILIZA","WHAT Zyrtec IS AND WHAT IT IS USED FOR",9,8
"3582","es","en","QUE HACER EN CASO DE URGENCIA","WHAT TO DO IN AN EMERGENCY",6,6
"3583","es","en","Qué hacer en caso de urgencia, para más información sobre hipoglucemias.","See 4 What to do in an emergency for more about hypos.",12,11
"3584","es","en","Que presenten tumores próximos a la zona de seudoartrosis.","have any tumour in the vicinity of the non-union site;",10,9
"3585","es","en","Queda por establecer la importancia clínica de estas observaciones.","The clinical relevance of these findings is still uncertain.",9,9
"3586","es","en","quelación y a un efecto no específico sobre la capacidad de absorción del tracto gastrointestinal.","due to a nonspecific effect on the absorption capacity of the gastrointestinal tract.",13,15
"3587","es","en","Quintanrix no debe administrarse a personas hipersensibles (alérgicas) a cualquiera de los principios dic","Quintanrix should not be used in people who may be hypersensitive (allergic) to any of the active lP",18,14
"3588","es","en","Quitar la tapa de plástico del envase de vidrio que contiene el polvo liofilizado","Remove the plastic cover from the glass container containing the powder",11,14
"3589","es","en","Rabigen SAG2 es una vacuna.","Rabigen SAG2 is a vaccine.",5,5
"3590","es","en","Rafe Survana, en sustitución del Dr.","Rafe Survana was appointed Co-Rapporteur, replacing Dr.",7,6
"3591","es","en","Raltegravir atravesó fácilmente la placenta en ratas, pero no penetró en el cerebro en una magnitud apreciable.","Raltegravir readily crossed the placenta in rats, but did not penetrate the brain to any appreciable extent.",17,17
"3592","es","en","RAN ≥ 1,5 x 109/ 1 y recuento de plaquetas ≥ 100 x 109/ l.","ANC ≥ 1.5 x 109/l and platelet count ≥ 100 x 109/l.",12,15
"3593","es","en","Rapamune debe administrarse con corticosteroides.","Rapamune should be given with corticosteroids.",6,5
"3594","es","en","Rara vez se han encontrado elevaciones de las enzimas hepáticas y de la bilirrubina sérica.","Elevation of liver enzymes and serum bilirubin have been reported rarely.",11,15
"3595","es","en","Raramente se ha comunicado la aparición de ampollas e hinchazón.","Blisters and swelling were reported rarely.",6,10
"3596","es","en","Raramente se han notificado casos de edema intestinal en pacientes tratados con inhibidores de la ECA.","Intestinal oedema has been reported rarely in patients treated with ACE inhibitors.",12,16
"3597","es","en","Raras: calambres musculares, dolor en el hombro","Renal and urinary disorders:",4,7
"3598","es","en","Raras: dermatitis exfoliativa, dermatitis, prurito, alopecia.","Rare: exfoliative dermatitis, dermatitis, pruritus, alopecia.",6,6
"3599","es","en","Raros (0,01-0,1%): insomnio, agitación y depresión después de dosis elevadas.","Psychiatric disorders Rare (0.01-0.1%): insomnia, agitation and depression after high doses.",11,10
"3600","es","en","Raros (afectan a menos de 1 de cada 1.000 pacientes):","Rare (affecting less than 1 in 1,000 patients):",8,10
"3601","es","en","Raros: fotosensibilidad, eritema multiforme y eritema nodoso.","Rare: photosensibility, erythema multiforme and erythema nodusum.",7,7
"3602","es","en","Rasilez 300 mg comprimidos recubiertos con película Aliskiren","Rasilez 300 mg film-coated tablets Aliskiren",6,8
"3603","es","en","Rasilez se excretó en la leche de ratas en periodo de lactancia.","Rasilez was secreted in the milk of lactating rats.",9,12
"3604","es","en","Ratiopharm GmbH Graf Arco Strasse 3 89079 Ulm Alemania","Ratiopharm GmbH Graf Arco Strasse 3 89079 Ulm Germany",9,9
"3605","es","en","Ratiopharm GmbH, Graf-Arco-Strasse 3, D-89079 Ulm, Germany","Ratiopharm GmbH, Graf-Arco-Strasse 3, D-89079 Ulm, Germany",7,7
"3606","es","en","RCp = remisión completa en ausencia de recuperación total de las plaquetas","CRp = Complete Remission in the Absence of Total Platelet Recovery PR = Partial Remission",15,12
"3607","es","en","Reacción adversa* Todos los grados","Adverse reaction* All grades",4,5
"3608","es","en","reacción alérgica, erupción vesiculobullosa, erupción pustular, erupción maculopapular, exantema, prurito, urticaria, hiperpigmentación de la piel","allergic reaction, vesiculobullous rash, pustular rash, maculopapular rash, rash, pruritus, urticaria, skin discolouration (increased pigmentation)",15,15
"3609","es","en","Reacciones adversas de tipo hematológico relacionadas con zidovudina","Haematological adverse reactions with zidovudine",5,8
"3610","es","en","Reacciones adversas en ensayos clínicos con pacientes con cáncer Trastornos del sistema inmunológico","Adverse reactions in clinical trials in cancer patients Immune system disorders",11,13
"3611","es","en","Reacciones adversas en los ensayos clínicos y estudios de post-comercialización en pacientes adultos Trastornos del sistema inmunológico","Undesirable Effects in Clinical Studies and Post-marketing in Adult Patients Immune system disorders",13,17
"3612","es","en","Reacciones adversas graves e imprevistas a medicamentos","Serious unexpected adverse drug reactions",5,7
"3613","es","en","Reacciones adversas muy frecuentes ≥ 10% de los pacientes","Uncommon adverse reactions ≥ 0.1 to < 1% of patients",10,9
"3614","es","en","Reacciones adversas notificadas con Abraxane con cualquier dosis en ensayos clínicos.","Adverse reactions reported with Abraxane at any dose in clinical trials.",11,11
"3615","es","en","Reacciones adversas notificadas en los ensayos clínicos de saquinavir potenciado con ritonavir","Adverse reactions from clinical trials where saquinavir was boosted with ritonavir",11,12
"3616","es","en","Reacciones adversas notificadas muy frecuentemente y frecuentemente durante","Adverse reactions very commonly and commonly reported during clinical trials of",11,8
