"","language_a","language_b","a_text","b_text","sentence_length_b","sentence_length_a"
"1151","es","en","El uso de anticonvulsivantes (carbamazepina, fenobarbital, fenitoína) debe realizarse con precaución.","Anticonvulsants (carbamazepine, phenobarbital, phenytoin) should be used with caution.",9,11
"1152","es","en","El uso de carbón activado puede ser beneficioso.","The use of activated charcoal may be beneficial.",8,8
"1153","es","en","El uso de IDflu debe basarse en las recomendaciones oficiales.","The use of IDflu should be based on official recommendations.",10,10
"1154","es","en","El uso de Neupro se ha asociado a somnolencia, incluyendo excesiva somnolencia diurna y episodios de sueño repentino.","Neupro has been associated with somnolence including excessive daytime somnolence and sudden sleep onset episodes.",15,18
"1155","es","en","El uso de Oxyglobin no requiere comprobar el tipo de sangre del receptor.","Use of Oxyglobin does not require typing or cross – matching of the recipient ’ s blood.",17,13
"1156","es","en","El uso de Rotarix deberá estar sujeto a las recomendaciones oficiales.","Rotarix is given according to official recommendations.",7,11
"1157","es","en","El uso de Thyrogen debe supervisarlo un médico experto en el cáncer de tiroides.","The use of Thyrogen should be supervised by a doctor with expertise in thyroid cancer.",15,14
"1158","es","en","El uso de VIAGRA no está indicado en mujeres.","VIAGRA is not indicated for use by women.",8,9
"1159","es","en","El valor de t1/ 2 está comprendido entre 3,2 y 6 horas.","T½ is between 3.2 and 6 hours.",7,12
"1160","es","en","El vial puede contener alta presión debido a radiólisis.","The vial may contain high pressure due to radiolysis.",9,9
"1161","es","en","El volumen de distribución en sangre es de alrededor de 150 ml/ Kg.","The volume of distribution in blood is approximately 150 ml/ kg.",11,13
"1162","es","en","El volumen de distribución fue de 0,5 l/ kg.","The volume of distribution was 0.5 l/ kg.",8,9
"1163","es","en","El volumen reconstituido es de 10,6 ml.","The reconstituted volume is 10.6 ml.",6,7
"1164","es","en","Elan Pharma International Ltd.","Elan Pharma International Ltd.",4,4
"1165","es","en","Elevación de ALT > 2x valor basal y > 10x LSN","ALT elevation > 2x baseline and > 10x ULN",9,11
"1166","es","en","Eli Lilly and Company Ltd Priestley Road, Basingstoke Hampshire RG24 9NL Reino Unido","Eli Lilly and Company Ltd Priestley Road, Basingstoke Hampshire RG24 9NL United Kingdom",13,13
"1167","es","en","Eli Lilly N. V.","Eli Lilly N. V.",4,4
"1168","es","en","Eli Lilly Nederland BV, Groostlag 1-5, NL-3991 RA Houten, Holanda.","Eli Lilly Nederland BV, Grootslag 1-5, NL-3991 RA Houten, The Netherlands.",11,10
"1169","es","en","Elija una hora que le resulte cómoda y tome sus comprimidos a esta hora cada día.","Choose a time that is convenient for you and take your tablets at this time each day.",17,16
"1170","es","en","Eliminación Metformina se elimina por excreción renal.","Elimination Metformin is eliminated by renal excretion.",7,7
"1171","es","en","Eliminación Valdecoxib se elimina por metabolismo hepático recuperándose menos del 5% de valdecoxib inalterado en la orina.","Elimination Valdecoxib is eliminated via hepatic metabolism with less than 5% unchanged valdecoxib recovered in the urine.",17,17
"1172","es","en","Eliminación: el perfil concentración– tiempo tras la administración intravenosa se describe adecuadamente mediante un modelo bicompartimental.","The concentration-time profile following intravenous administration is well described by a two-compartment model.",13,16
"1173","es","en","Elimine el aire del cartucho y aguja.","Expel air from the cartridge and needle.",7,7
"1174","es","en","Ello dependerá de su peso corporal y de la cantidad de IgE que tenga en la sangre.","This will depend on your body weight and the amount of IgE measured in your blood.",16,17
"1175","es","en","EMADINE 0,5 mg/ ml Colirio en solución en envase multidosis.","EMADINE 0.5 mg/ml Eye Drops, solution in multidose container.",9,10
"1176","es","en","EMBALAJE DEL COMPONENTE INDIVIDUAL (NO INCLUYE UNA BLUE BOX) SOLO PARA ENVASES MULTIPLES (112 COMPRIMIDOS)","INTERMEDIATE CARTON (WITHOUT BLUE BOX) MULTIPACKS ONLY (3x112 TABLETS)",9,15
"1177","es","en","EMBALAJE EXTERIOR {vial de 50 ml, vial de 100 ml y vial de 200 ml}","OUTER CARTON {50 ml vial, 100 ml and 200 ml vial}",11,15
"1178","es","en","EMBALAJE EXTERIOR Y ETIQUETA DEL FRASCO DE GRANULADO","OUTER CARTON AND BOTTLE LABEL FOR GRANULES",7,8
"1179","es","en","Embarazo No existen estudios adecuados y bien controlados sobre el uso de darunavir en mujeres embarazadas.","Pregnancy There are no adequate and well controlled studies with darunavir in pregnant women.",14,16
"1180","es","en","Embarazo Se dispone de datos clínicos limitados en el embarazo para tenofovir disoproxil fumarato.","Pregnancy For tenofovir disoproxil fumarate limited clinical data on exposed pregnancies are available.",13,14
"1181","es","en","Embarazo Si se puede quedar embarazada, use medidas anticonceptivas durante el tratamiento con Extavia.","Pregnancy Women at risk of becoming pregnant should use contraception during treatment with Extavia.",14,14
"1182","es","en","Embarazo y lactancia ADROVANCE sólo está destinado para el uso en mujeres postmenopáusicas.","Pregnancy and breast-feeding ADROVANCE is only intended for use in postmenopausal women.",12,13
"1183","es","en","Embarazo y lactancia Consulte a su médico o farmacéutico antes de utilizar cualquier medicamento.","Pregnancy and breast-feeding Ask your doctor or pharmacist for advice before taking any medicine.",14,14
"1184","es","en","Embarazo y lactancia No debe usar Xolair cuando esté embarazada.","Pregnancy and breast-feeding You should not take Xolair when you are pregnant.",12,10
"1185","es","en","Embarazo y lactancia No tome Tekturna si está embarazada.","Pregnancy and breast-feeding Do not take Tekturna if you are pregnant.",11,9
"1186","es","en","Embarazo y lactancia SonoVue no ha sido estudiado en mujeres embarazadas.","Pregnancy and breast-feeding SonoVue has not been studied in pregnant women.",11,11
"1187","es","en","Embarazo: la experiencia sobre el uso de buprenorfina/ naloxona en mujeres embarazadas es muy limitada.","There is very limited experience with buprenorphine/ naloxone in pregnant women.",11,15
"1188","es","en","Emtricitabina tampoco inhibe la enzima responsable de la glucuronización.","Emtricitabine did not inhibit the enzyme responsible for glucuronidation.",9,9
"1189","es","en","Emtriva está también disponible en cápsulas duras.","Emtriva is also available as hard capsules.",7,7
"1190","es","en","En 1998 se designaron ponentes y ponentes adjuntos para solicitudes que representaban 32 principios activos.","Rapporteurs and co-rapporteurs were appointed for applications representing 32 active substances in 1998.",13,15
"1191","es","en","En 2003 se espera un aumento significativo de la carga de trabajo en esta área.","Working parties and ad hoc groups",6,15
"1192","es","en","En 61 de estos 117 pacientes se identificaron quinasas de fusión FIP1L1-PDGFRα.","In 61 of these 117 patients FIP1L1-PDGFRα fusion kinase was identified.",11,12
"1193","es","en","En adolescentes, el dolor de cabeza fue la reacción adversa comunicada más frecuentemente.","In adolescents, headache was the most commonly reported side effect.",10,13
"1194","es","en","En algunos casos muy graves, estos daños musculares podrían llegar a provocar insuficiencia renal.","In very severe cases this could lead to kidney failure.",10,14
"1195","es","en","En algunos casos puede producirse hipertermia hasta 2 días.","In some cases hyperthermia may occur for up to 2 days.",11,9
"1196","es","en","En algunos casos, los medicamentos pueden alterar la forma de actuar de otros medicamentos.","In some cases, medicines can affect the way other medicines work.",11,14
"1197","es","en","En algunos Estados miembros, la administración puede repetirse al cabo de cinco días en caso de problemas graves.","In some Member States this administration can be repeated after five days in the face of severe challenge.",18,18
"1198","es","en","En algunos varones tratados, se han notificado casos de impotencia, esterilidad, azoospermia, y atrofia testicular.","Impotence, sterility, azoospermia, and testicular atrophy have been reported in male patients.",12,15
"1199","es","en","En ambos ensayos, el resultado del tratamiento con Thelin fue un aumento significativo en la capacidad de ejercicio.","In both trials, treatment with Thelin resulted in a significant increase in exercise capacity.",14,18
"1200","es","en","En ambos estudios participaron pacientes adultos (≥ 18 años) que habían recibido Toxina Botulínica Tipo A con anterioridad.","Both studies enrolled adult patients (≥ 18 years) who had a history of receiving Botulinum Toxin Type A.",18,18
"1201","es","en","En animales, no se hallaron efectos adversos sobre la fertilidad en machos o hembras (ver sección 5.3).","In animals, no adverse effects on male or female fertility were found (see section 5.3).",15,17
"1202","es","en","En aquellos pacientes que desarrollan esta sintomatología, el aumento de la dosis puede ser perjudicial.","In patients who develop these symptoms, increasing the dose may be detrimental.",12,15
"1203","es","en","En aquellos pacientes que necesiten un mayor alivio de los síntomas, puede aumentarse la dosis hasta 15 mg.","For those patients requiring greater symptom relief, the dose may be increased to 15 mg.",15,18
"1204","es","en","En ausencia de estudios de compatibilidad, este medicamento no debe mezclarse con otros medicamentos.","In the absence of compatibility studies, this medicinal product must not be mixed with other medicinal products.",17,14
"1205","es","en","En ausencia de toxicidad materna no se ha observado toxicidad fetal.","This means that patients usually may drive or perform tasks requiring concentration.",12,11
"1206","es","en","En cada banda de peso se debe aplicar todo el contenido de la pipeta del tamaño adecuado.","Within each weight band the entire contents of the correct size pipette should be used.",15,17
"1207","es","en","En caso contrario, el tratamiento debe iniciarse con 4,6 mg/ 24 h.","Otherwise treatment should be re-initiated with 4.6 mg/ 24 h.",10,12
"1208","es","en","En caso de administración concomitante se recomienda precaución.","Caution is recommended in case of co-administration.",7,8
"1209","es","en","En caso de apreciarse alguna de estas circunstancias, desechar el envase.","In the event of either being observed, discard the vaccine.",10,11
"1210","es","en","En caso de deterioro clínico, pese al tratamiento con Revatio, deberán considerarse terapias alternativas.","In case of clinical deterioration in spite of Revatio treatment, alternative therapies should be considered.",15,14
"1211","es","en","En caso de embarazo durante el uso de EVRA, se debe interrumpir el uso de EVRA de inmediato.","If pregnancy occurs during use of EVRA, EVRA should be stopped immediately.",12,18
"1212","es","en","En caso de exposición accidental al medicamento deberá lavarse la piel y aclararse los ojos con agua.","Wash the skin and rinse eyes with water, if accidental exposure occurs.",12,17
"1213","es","en","En caso de ingestión accidental, debe administrarse tratamiento sintomático.","In case of accidental oral uptake, symptomatic treatment should be administered.",11,9
"1214","es","en","En caso de insuficiencia renal severa, Neoclarityn deberá utilizarse con precaución (ver sección 5.2).","In the case of severe renal insufficiency, Neoclarityn should be used with caution (see section 5.2).",16,14
"1215","es","en","En caso de observar otros efectos adversos, por favor informe a su veterinario.","If you notice any other side effects, please inform your veterinary surgeon.",12,13
"1216","es","en","En caso de shock, debe emplearse el tratamiento médico habitual.","In case of shock, standard medical treatment for shock should be implemented.",12,10
"1217","es","en","En caso de sobredosificación discontinuar la terapia.","In the case of overdosage discontinue therapy.",7,7
"1218","es","en","En caso de sobredosificación puede haber mayor riesgo de hemorragia.","In the event of overdosage there may be an increased risk of bleeding.",13,10
"1219","es","en","En caso de sobredosis accidental, debe consultar inmediatamente con su veterinario y debe iniciarse un tratamiento sintomático.","In cases of accidental overdose your veterinary surgeon should be consulted immediately and symptomatic therapy should be initiated.",18,17
"1220","es","en","En caso de sobredosis consulte a su médico.","Consult your doctor if you have taken an overdose.",9,8
"1221","es","en","En caso de tener síntomas de cualquier infección, por ejemplo: fiebre, heridas,","r • If you have a severe infection, including active tuberculosis (see “Take special care with",16,12
"1222","es","en","En caso de volúmenes más grandes, debe elegirse más de un lugar para la inyección.","In case of larger volumes, more than one site should be chosen for the injection.",15,15
"1223","es","en","En caso necesario, en 1998 se creará un Sector específico para los arbitrajes.","If necessary, a dedicated Sector would have to be created in 1998 to deal with arbitrations.",16,13
"1224","es","en","En condiciones de laboratorio, se demostró que Purevax RCPCh confería protección frente a las enfermedades indicadas.","In laboratory conditions Purevax RCPCh was demonstrated to provide protection against the diseases listed above.",15,16
"1225","es","en","En condiciones normales, esta enzima descompone una sustancia grasa denominada globotriaosilceramida (GL3).","This enzyme normally breaks down a fatty substance called globotriaosylceramide (GL-3).",11,12
"1226","es","en","En consecuencia el CHMP decidió conceder a Actos la autorización de comercialización.","The committee recommended that Actos be given marketing authorisation.",9,12
"1227","es","en","En consecuencia, el CHMP acordó recomendar las siguientes dosis:","The CHMP therefore agreed to recommend the following dosage recommendation:",10,9
"1228","es","en","En consecuencia, el Comité recomendó que se aprobase la comercialización de Cubicin.","The Committee recommended that Cubicin be given marketing authorisation.",9,12
"1229","es","en","En consecuencia, el Comité recomendó que se autorizara su comercialización.","The Committee recommended that AZILECT be given marketing authorisation.",9,10
"1230","es","en","En consecuencia, el Comité recomendó que se autorizase la comercialización de Infanrix Hexa.","The Committee recommended that Infanrix Hexa be given marketing authorisation.",10,13
"1231","es","en","En consecuencia, el Comité recomendó que se autorizase su comercialización.","The Committee recommended that Levitra be given marketing authorisation.",9,10
"1232","es","en","En consecuencia, el CVMP recomienda una variación de la autorización de comercialización.","The CVMP therefore recommends a variation of the Marketing Authorisation.",10,12
"1233","es","en","En consecuencia, el flujo sanguíneo periférico se eleva y no se modifica la frecuencia cardíaca.","As a consequence, peripheral blood flow increases, with no effect on heart rate.",13,15
"1234","es","en","En consecuencia, el producto de factor IX utilizado resulta inactivado (véase Posibles efectos adversos).","As a result, the factor IX product used becomes inactivated (see Possible side effects).",14,14
"1235","es","en","En consecuencia, recomendó que se autorizase la comercialización de Preotact.","They recommended that Preotact be given marketing authorisation.",8,10
"1236","es","en","En consecuencia, recomendó que se autorizase su comercialización.","They recommended that Fevaxyn Pentofel should be given a marketing authorisation.",11,8
"1237","es","en","En cualquier momento del tratamiento podrá beber agua del grifo.","Plain water may be taken at any time during the course of Bondronat treatment.",14,10
"1238","es","en","En cualquiera de estos casos, deberá informar a su médico.","If any of these apply, you should inform your doctor.",10,10
"1239","es","en","En cuanto a los niños, el tratamiento debería continuar hasta finalizar la etapa de crecimiento.","For children, the treatment should be continued until the end of the growth has been reached.",16,15
"1240","es","en","En dos pacientes los anticuerpos indicaron efecto inhibitorio in vitro.","In two patients the antibodies showed inhibitory effect in vitro.",10,10
"1241","es","en","En el adulto, las tres indicaciones se tratan con dosis de 10 mg diarios de cetirizina.","In adults, all three indications are treated by a 10 mg daily dose of cetirizine.",15,16
"1242","es","en","En el anexo 4 se indica la composición de dicho Comité.","Membership of the Committee is given in Annex 4.",9,11
"1243","es","en","En el anexo 7 se facilitan más datos sobre las autorizaciones comunitarias de comercialización concedidas para medicamentos veterinarios.","Details of Community marketing authorisations granted for veterinary medicinal products are given in Annex 7.",15,18
"1244","es","en","En el ensayo de fase II (estudio 001/ 007) se incluyeron sólo mujeres que:","The phase II trial (study 001/ 007) enrolled only women who:",11,14
"1245","es","en","En el ensayo PEARL se observaron resultados similares para el pH vaginal y el IM.","Similar results for vaginal pH and MI were observed in the PEARL study.",13,15
"1246","es","en","En el envase exterior","On the outer package you",5,4
"1247","es","en","En el Estudio 2a (N = 99) la tasa de respuesta global aumentó hasta el 56,1%.","In Study 2a (N = 99), the overall response rate increased to 56.1%.",13,16
"1248","es","en","En el estudio con adultos, el 34% de ambos grupos de adultos presentaron respuesta favorable.","In the adult study, 34% of both groups of adults had a favourable response.",14,15
"1249","es","en","En el estudio con niños, Apidra e insulina lispro produjeron cambios similares del HbA1c pasados seis meses.","In the study in children, Apidra and insulin lispro produced similar changes in HbA1c after six months.",17,17
"1250","es","en","En el estudio no se comparó Evoltra con ningún otro tratamiento.","The study did not compare Evoltra with any other treatments.",10,11
"1251","es","en","En el etiquetado de la caja puede encontrarse información sobre las condiciones de administración de este medicamento.","Information on the prescription status of this product may be found on the outer package.",15,17
"1252","es","en","En el etiquetado de la caja puede encontrarse información sobre las condiciones de dispensación de este producto.","Information on the prescription status of this product may be found on the label/ outer package.",16,17
"1253","es","en","En el hombre, la FSH es necesaria para la producción de esperma.","In men, FSH is needed for the production of sperm.",10,12
"1254","es","en","En el muestreo angular no deben adquirirse menos de 120 imágenes en 360 grados preferentemente.","Angular sampling should preferably be not less than 120 views over 360 degrees.",13,15
"1255","es","en","En el ojo, la prostaglandina aumenta el drenaje del líquido acuoso (humor acuoso) fuera del globo ocular.","In the eye, prostaglandin increases the drainage of the watery fluid (aqueous humour) out of the eyeball.",17,17
"1256","es","en","En el otro, se comparó Insulin Human Winthrop Comb 25 con insulina humana semisintética.","In the other study, Insulin Human Winthrop Comb 25 was compared with semi-synthetic human insulin.",15,14
"1257","es","en","En el presente documento se resume el Informe Público Europeo de Evaluación (EPAR).","This document is a summary of the European Public Assessment Report (EPAR).",12,13
"1258","es","en","En el prospecto encontrará las instrucciones de uso completas.","See the Package Leaflet for full instructions for use.",9,9
"1259","es","en","en el recuento de plaquetas (puede aumentar su predisposición a los moratones y hemorragias)","in blood platelets (may make you more prone to bruising and bleeding)",12,14
"1260","es","en","En ese caso, continúe con la siguiente dosis del modo normal.","In that case carry on with the next dose as normal.",11,11
"1261","es","en","En esta situación, el balance beneficio/ riesgo del tratamiento con Trudexa debe ser cuidadosamente considerado. r uto","In this situation, the benefit/ risk balance of therapy with Trudexa should be very carefully considered.",16,17
"1262","es","en","En este caso, debe tomar los comprimidos solamente una o dos veces al día.","In this case, you will have to take the tablets only once or twice a day.",16,14
"1263","es","en","En este caso, Luveris debe reconstituirse primero y luego utilizarse para reconstituir el polvo de follitropina alfa.","In this case Luveris should be reconstituted first and then used to reconstitute the follitropin alfa powder.",17,17
"1264","es","en","En este momento, compruebe que la dosis es la correcta.","At that point check that you have the correct dose.",10,10
"1265","es","en","En este subgrupo, hubo una tasa de respuesta virológica sostenida del 92% (89/97).","In this subgroup, there was a 92% (89/97) sustained virological response rate.",12,13
"1266","es","en","En estos 46 pacientes, el porcentaje medio de reducción del colesterol LDL fue de aproximadamente el 21%.","From these 46 patients, the mean percent reduction in LDL-C was approximately 21%.",13,17
"1267","es","en","En estos casos, el tratamiento debe ser interrumpido de inmediato y permanentemente y debe iniciarse una terapia adecuada.","In such cases, treatment should immediately and permanently be discontinued and appropriate therapy initiated.",14,18
"1268","es","en","En estos casos, fue frecuente el tratamiento concomitante con otros fármacos hepatotóxicos.","Co- medication with other hepatotoxic medicinal products was frequently present.",10,12
"1269","es","en","En estos casos, se recomienda posponer la vacunación hasta el final de la enfermedad o del tratamiento.","In such cases it is recommended to postpone the vaccination until the end of the disease or treatment.",18,17
"1270","es","en","En estos pacientes deben controlarse los niveles séricos de calcio y monitorizarse la función renal.","In these patients serum calcium levels should be followed and renal function should be monitored.",15,15
"1271","es","en","En estos tres estudios de seis semanas, los resultados de eficacia al finalizar los ensayos, fueron los siguientes:","In these three 6-week studies, the efficacy results at endpoint were as follows:",13,18
"1272","es","en","En estudios in vitro, no se ha observado antagonismo entre tigeciclina y otras clases de antibióticos comúnmente utilizadas.","In in vitro studies, no antagonism has been observed between tigecycline and other commonly used antibiotic classes.",17,18
"1273","es","en","En función de su situación concreta, puede ser preferible recibir una transfusión sanguínea.","Depending on your individual situation a blood transfusion may be preferable.",11,13
"1274","es","en","En general, el tratamiento debe continuar durante al menos 7 días después de la desaparición de los síntomas.","In general, treatment should continue for at least 7 days after resolution of symptoms.",14,18
"1275","es","en","En la bandeja también se incluye otra aguja para administrar la inyección.","A separate needle to give the injection is also included in the tray.",13,12
"1276","es","en","En la candidiasis bucofaríngea, Posaconazole SP fue tan eficaz como el fluconazol.","In oropharyngeal candidiasis, Posaconazole SP was as effective as fluconazole.",10,12
"1277","es","en","En la mayoría de estos casos se administró Mabthera en combinación con quimioterapia.","In the majority of these cases, MabThera was administered with chemotherapy.",11,13
"1278","es","en","En la mayoría de los casos necesitará un médico.","In most cases you will need a doctor.",8,9
"1279","es","en","En la mayoría de los casos, las reacciones adversas generalmente no han requerido la interrupción del tratamiento.","The majority of adverse reactions have not usually required cessation of therapy.",12,17
"1280","es","en","En la tabla 5 se presentan los resultados de eficacia adicional.","Further efficacy results are reported in Table 5.",8,11
"1281","es","en","En la Tabla 9 se presentan los resultados.","Results are presented in Table 9.",6,8
"1282","es","en","En los caballos se pueden producir reacciones alérgicas (hipersensibilidad) que deben recibir tratamiento sintomático.","In horses, anaphylactoid (hypersentivity) reactions can occur and should be treated symptomatically.",12,14
"1283","es","en","En los cuatro ensayos controlados con placebo los hazard ratios (índice de riesgo) para la","In the four placebo-controlled studies the hazard in",8,15
"1284","es","en","En los ensayos clínicos se han empleado pautas posológicas alternativas.","Alternative dosing regimens have been used in clinical studies.",9,10
"1285","es","en","En los ensayos clínicos, el rango de dosis eficaz fue de 900 a 3600 mg/ día.","In clinical trials, the effective dosing range was 900 to 3600 mg/ day.",13,16
"1286","es","en","En los ensayos clínicos, los comprimidos se han estudiado durante hasta 14 días de tratamiento.","In clinical trials the tablets have been studied for up to 14 days treatment.",14,15
"1287","es","en","En los ensayos en artritis psoriásica se evaluaron los cambios radiográficos.","Radiographic changes were assessed in the psoriatic arthritis studies.",9,11
"1288","es","en","En los estudios clínicos no se ha observado inducción del metabolismo hepático.","Induction of hepatic metabolism has not been observed in clinical studies.",11,12
