"","language_a","language_b","a_text","b_text","sentence_length_b","sentence_length_a"
"2203","es","en","La semivida de timolol en plasma es de aproximadamente 4 a 6 horas.","The half-life of timolol in plasma is about 4 to 6 hours.",12,13
"2204","es","en","La semolina se usa como transportador.","Semoline is employed as carrier.",5,6
"2205","es","en","La sobredosis aguda puede conducir inicialmente a hipoglucemia y posteriormente a hiperglucemia.","Acute overdose could lead initially to hypoglycaemia and subsequently to hyperglycaemia.",11,12
"2206","es","en","La sobredosis de Efient puede provocar prolongación del tiempo de sangría y posteriores complicaciones hemorrágicas.","Overdose of Efient may lead to prolonged bleeding time and subsequent bleeding complications.",13,15
"2207","es","en","La sobredosis masiva puede provocar una hipotensión marcada que requerirá soporte cardiovascular activo.","Massive overdose may result in pronounced hypotension requiring active cardiovascular support.",11,13
"2208","es","en","La sobredosis puede causar náuseas y vómitos.","Overdosage may cause nausea or vomiting.",6,7
"2209","es","en","La solicitud estaba en su “ día 174” cuando fue retirada por la empresa.","The application was at day 174 when the company withdrew.",10,14
"2210","es","en","La solución contiene 10'000 UI de epoetina dseta por ml.","The solution contains 10000 IU Epoetin zeta per ml.",9,10
"2211","es","en","La solución de Enbrel no debería mezclarse con ningún otro medicamento.","Do not mix the Enbrel solution with any other medicine.",10,11
"2212","es","en","La solución de MabCampath se presenta en una ampolla de vidrio.","MabCampath is contained in solution in a glass ampoule.",9,11
"2213","es","en","La solución de rasburicasa debe perfundirse durante 30 minutos.","Rasburicase solution should be infused over 30 minutes.",8,9
"2214","es","en","La solución de transparente a ligeramente opalescente y de incolora a amarilla pálida no debe tener partículas visibles.","The clear to slightly opalescent and colourless to pale yellow solution should be free of visible particles.",17,18
"2215","es","en","La solución debe ser clara e incolora.","The solution should be clear and colourless.",7,7
"2216","es","en","La solución debe utilizarse inmediatamente tras la reconstitución.","The solution should be used immediately after reconstitution.",8,8
"2217","es","en","La solución es transparente e incolora.","The solution is clear and colourless.",6,6
"2218","es","en","La solución intravenosa de CellCept nunca se debe administrar mediante inyección intravenosa rápida o en bolus.","CellCept IV solution should never be administered by rapid or bolus intravenous injection.",13,16
"2219","es","en","La solución inyectable diluida debe utilizarse inmediatamente.","The diluted solution for injection should be used immediately.",9,7
"2220","es","en","La solución inyectable en uncartucho precargado está lista para su uso con el dispositivo de autoinyección RebiSmart.","The solution for injection in a pre-filled cartridge is ready for use with the RebiSmart autoinjector device.",17,17
"2221","es","en","La solución no utilizada debe desecharse (ver sección 3).","Any unused solution should be discarded (see section 3).",9,9
"2222","es","en","La solución no utilizada, los viales vacíos y las agujas y jeringas utilizadas deben ser eliminados adecuadamente.","All unused solution, empty vials and used needles and syringes must be discarded appropriately.",14,17
"2223","es","en","La solución oral está indicada para pacientes que no pueden tomar los comprimidos o las cápsulas.","The oral solution is for patients who cannot take the tablets or capsules.",13,16
"2224","es","en","La solución premezcla debe utilizarse inmediatamente después de su preparación.","The premix solution should be used immediately after preparation.",9,10
"2225","es","en","La solución reconstituida contiene 150 UI/ ml.","The reconstituted solution contains 150 IU/ ml.",7,7
"2226","es","en","La solución reconstituida es transparente e incolora.","The reconstituted solution is clear and colourless.",7,7
"2227","es","en","La solución se mezclará suavemente antes de la perfusión.","The solution is to be mixed gently before infusion.",9,9
"2228","es","en","La solución, si se ha refrigerado, debe alcanzar la temperatura ambiente antes de la administración.","Allow the refrigerated solution to reach room temperature before administration.",10,15
"2229","es","en","La supervivencia del páncreas en 1 año fue significativamente superior con tacrolimus:","Pancreas survival at 1 year was significantly superior with tacrolimus:",10,12
"2230","es","en","La sustancia activa es cloruro de (90Y) itrio.","The active substance is Yttrium (90Y) Chloride.",7,8
"2231","es","en","La tapa lleva impreso “ Temodal”.","The cap is imprinted with “Temodal”.",6,6
"2232","es","en","La tasa de respuesta global fue 14,1%.","The overall response rate was 14.1%.",6,7
"2233","es","en","La tasa de supervivencia, del 41%, dependió mucho de la situación clínica.","The survival rate of 41% depended very much on the clinical situation.",12,12
"2234","es","en","La telitromicina se distribuye ampliamente por el organismo.","Telithromycin is widely distributed throughout the body.",7,8
"2235","es","en","La tinta de impresión está compuesta por rojo óxido de hierro (E172), shellac, lecitina de soja.","The printing ink is composed of red iron oxide (E172), shellac, soya lecithin.",13,16
"2236","es","en","La toxina botulínica de tipo B es una sustancia tóxica producida por la bacteria Clostridium botulinum.","Botulinum toxin type B is a toxic substance produced by the bacterium Clostridium botulinum.",14,16
"2237","es","en","La trabectedina no debe utilizarse durante el embarazo salvo que fuera claramente necesario.","Trabectedin should not be used during pregnancy unless clearly necessary.",10,13
"2238","es","en","La unión de ciprofloxacino a las proteínas es baja (20 al 30%).","Pprotein binding of ciprofloxacin is low (20-30%).",7,12
"2239","es","en","La unión es de larga duración.","The binding is long-lasting.",4,6
"2240","es","en","La utilización de este procedimiento en 1998 fue la siquiente:","The mutual recognition procedure has made considerable progress during 1998.",10,10
"2241","es","en","La vacuna fue inmunogénica en ratones y conejos.","The vaccine was immunogenic in mice and rabbits.",8,8
"2242","es","en","La vacuna reduce los síntomas de la gripe y la excreción (eliminación) del virus por las aves infectadas.","The vaccine reduces the signs of flu and the excretion (shedding) of the virus by the infected birds.",18,18
"2243","es","en","La vacuna se administra mediante inyección en un músculo del cuello, detrás de la oreja.","The vaccine is given by injection into a muscle in the neck, in the area behind the ear.",18,15
"2244","es","en","La valoración rutinaria de este acontecimiento debe incluir recuentos sanguíneos completos y un reconocimiento físico.","Routine assessment of this event should include complete blood counts and physical examination.",13,15
"2245","es","en","La variabilidad farmacocinética interindividual de pregabalina es baja (< 20%).","Inter-subject pharmacokinetic variability for pregabalin is low (< 20%).",9,10
"2246","es","en","La variabilidad interindividual en la exposición a celecoxib es de unas 10 veces.","The inter-subject variability in the exposure of celecoxib is about 10-fold.",11,13
"2247","es","en","La velocidad de administración se determinará en función del grado de bienestar del paciente (velocidad máxima de inyección:","The rate of administration should be determined by the patient’ s comfort level (maximal rate of injection:",17,18
"2248","es","en","La versión completa del EPAR de Cetrotide puede consultarse en el sitio web dela Agencia Europea de Medicamentos.","The full EPAR for Cetrotide is available here.",8,18
"2249","es","en","La versión completa del EPAR de Suboxone puede encontrarse aquí.","The full EPAR for Suboxone can be found here.",9,10
"2250","es","en","La versión completa del EPAR puede consultarse aquí.","The full EPAR summary can be found here.",8,8
"2251","es","en","La vía sublingual es la única vía de administración eficaz para este medicamento.","Sublingual route is the only efficacious administration route for this product.",11,13
"2252","es","en","La vildagliptina no actúa cuando la concentración de glucosa en la sangre es baja.","Vildagliptin does not work when the blood glucose is low.",10,14
"2253","es","en","Laboratoire GlaxoSmithKline 100, route de Versailles 78163 Marly-le-Roi Cedex Francia Tel. +33 1 39 178000","Laboratoire GlaxoSmithKline 100, route de Versailles 78163 Marly-le-Roi Cedex France tel +33 1 39 178000",15,15
"2254","es","en","Laboratoires Janssen Cilag 1 rue Desmoulins TSA 91003 92787 Issy les Moulineaux Cedex 9, Francia","Laboratoires Janssen Cilag 1 rue Desmoulins TSA 91003 92787 Issy les Moulineaux Cedex 9, France",15,15
"2255","es","en","Laboratorios Abelló S. A.","Laboratorios Abelló S. A.",4,4
"2256","es","en","Laboratorios Inkeysa S. A.","Laboratorios Inkeysa S. A.",4,4
"2257","es","en","Lactancia Debeevitar amamantar a su hijo si toma Wilzin.","Breast-feeding Breast-feeding should be avoided if you are on Wilzin therapy.",11,9
"2258","es","en","Lactancia Indique inmediatamente a su médico si está en periodo de lactancia.","Breast-feeding Tell your doctor at once if you are breast-feeding.",10,12
"2259","es","en","Lactancia Se desconoce si el interferón beta-1b se excreta en la leche materna.","Lactation It is not known whether interferon beta-1b is excreted in human milk.",13,13
"2260","es","en","Lactancia Se desconoce si infliximab se excreta en la leche materna.","Breast-feeding It is not known if infliximab is excreted in human milk.",12,11
"2261","es","en","Lactancia Timolol se excreta en la leche materna.","Lactation Timolol is excreted in breast milk.",7,8
"2262","es","en","Lactosa Este medicamento contiene 299,2 mg de lactosa en cada dosis de 800 mg (dosis máxima única).","Lactose This medicinal product contains 299.2 mg of lactose in each 800-mg dose (maximum single dose).",16,17
"2263","es","en","Lactosa Estearato de magnesio Celulosa microcristalina Almidón glicolato sódico","Lactose Magnesium stearate Microcrystalline cellulose Sodium starch glycolate",8,9
"2264","es","en","Lactosa monohidrato Almidón de maíz Celulosa microcristalina Hidroxipropilcelulosa Estearato de magnesio","Lactose monohydrate Maize starch Microcrystalline cellulose Hydroxypropyl cellulose Magnesium stearate",10,11
"2265","es","en","lad CAD {MM/ YYYY}","ed EXP {MM/ YYYY}",4,4
"2266","es","en","lad LEVVIAX Denominación Común Internacional (DCI):","ris International Nonproprietary Name (INN):",5,6
"2267","es","en","lad titular de la autorización de comercialización.","For any information about this medicinal product, please contact the local representative of the Marketing Authorisation Holder.",17,7
"2268","es","en","Lagoas Park, Edifício 1, Piso 3, 2740-264 Porto Salvo Portugal","Box 217, 3640 AE Mijdrecht, The Netherlands,",7,10
"2269","es","en","Lansoprazol no debe administrarse con atazanavir (ver sección 4.5).","Lansoprazole should not be administered with atazanavir (see section 4.5).",10,9
"2270","es","en","Lansoprazol-AbZ 15 mg debe ingerirse con el estómago vacío (antes de las comidas).","Lansoprazol AbZ should be taken on an empty stomach (before meals).",11,13
"2271","es","en","Lansoprazolo ratiopharm 30 mg capsule di gelatina dura","capsule di gelatina dura",4,8
"2272","es","en","LansoTEVA 15 mg 15 mg kapsulka dojelitowa twarda","Lansoprazole 15 mg 15 mg Gastro-resistant Capsules",7,8
"2273","es","en","Lantus en cartuchos para OptiClik ha sido diseñado para utilizar sólo OptiClik.","Lantus in cartridge for OptiClik has been developed for use in OptiClik only.",13,12
"2274","es","en","Laropiprant suprime los sofocos mediados por la PGD2","Laropiprant suppresses PGD2 mediated flushing associated with administration of nicotinic acid.",11,8
"2275","es","en","Las 18 primeras semanas de tratamiento, constituyen un período crítico que requiere una estrecha monitorización (ver sección 4.4).","The first 18 weeks of treatment is a critical period which requires close monitoring (see section 4.4).",17,18
"2276","es","en","Las aberraciones cromosómicas se clasificaron de acuerdo con el modelo jerárquico de Döhner.","Chromosomal aberrations were categorized according to Döhner’ s hierarchical model.",10,13
"2277","es","en","Las agujas para inyección no están incluidas.","Injection needles are not included.",5,7
"2278","es","en","Las alteraciones de las pruebas de función hepática pueden estar asociadas con mayores concentraciones plasmáticas y/ o dosis.","Liver function test abnormalities may be associated with higher plasma concentrations and/ or doses.",14,18
"2279","es","en","Las ampollas están destinadas a un solo uso, deberá desecharse cualquier parte sin utilizar.","Ampoules are intended for single use only, any unused portions must be discarded.",13,14
"2280","es","en","Las autoridades competentes de los Estados miembros efectuarán controles regulares del producto.","The competent authorities of the Member States will continue to keep the product under regular review.",16,12
"2281","es","en","Las bacterias entéricas como E. coli son intrínsecamente resistentes a la pirlimicina.","Enteric bacteria such as E. coli are intrinsically resistant to pirlimycin.",11,12
"2282","es","en","Las bacterias pueden ser responsables del 60-70% de episodios clínicos de OMA.","Bacteria can be responsible for 60-70% of clinical episodes of AOM.",11,12
"2283","es","en","Las cápsulas de Emend debe tragarse enteras, con o sin alimento.","Emend capsules should be swallowed whole, with or without food.",10,11
"2284","es","en","Las cápsulas no se deben abrir.","Capsules should not be opened.",5,6
"2285","es","en","Las cápsulas se presentan en frascos de 100 cápsulas duras.","The capsules are provided in bottles containing 100 hard capsules.",10,10
"2286","es","en","Las cápsulas tienen que tragarse enteras.","The capsules should be swallowed whole.",6,6
"2287","es","en","Las características basales se muestran en la tabla 2.","Baseline characteristics are shown in Table 2.",7,9
"2288","es","en","Las cifras correspondientes a una reducción del dolor de al menos 50% fueron 50% y 26%, respectivamente.","The corresponding figures for at least 50% pain reduction were 50% and 26% respectively.",14,17
"2289","es","en","Las combinaciones de lansoprazol con uno o dos antibióticos determinaron una erradicación equivalente de H. pylori.","Combinations of lansoprazole with one or two antibiotics produced equivalent eradication of H. pylori.",14,16
"2290","es","en","Las concentraciones de estos medicamentos aumentan cuando se administran junto con Invirase/ritonavir.","Concentrations of these medicinal products increase several fold when co-administered with Invirase/ ritonavir.",13,12
"2291","es","en","Las concentraciones de HAMA deben ser determinadas antes de readministrar LeukoScan.","HAMA titers should be determined before repeated administration of LeukoScan.",10,11
"2292","es","en","Las concentraciones de warfarina pueden verse afectadas.","Concentrations of warfarin may be affected.",6,7
"2293","es","en","Las concentraciones en plasma cayeron en más del 95% en las 6 horas posteriores a la administración intravenosa.","Plasma concentrations fell by more than 95% within 6 hours following intravenous administration.",13,18
"2294","es","en","Las concentraciones máximas de vareniclina ocurren generalmente a las 3-4 horas después de la administración.","Maximum plasma concentrations of varenicline occur typically within 3-4 hours after oral administration.",13,15
"2295","es","en","Las concentraciones plasmáticas de lacosamida no se vieron afectadas por carbamazepina ni por ácido valproico.","Lacosamide plasma concentrations were not affected by carbamazepine and by",10,15
"2296","es","en","Las concentraciones plasmáticas máximas de rosiglitazona se alcanzan aproximadamente 1 h después de la ingesta.","Rosiglitazone plasma concentrations peak at around 1 h after dosing.",10,15
"2297","es","en","Las conclusiones científicas figuran como Anexo II y el Resumen de Características del Producto como Anexo III.","The scientific conclusions are provided in Annex II, together with the Summary of Product Characteristics in Annex III.",18,17
"2298","es","en","Las conclusiones relativas a las Autorizaciones de Comercialización figuran en el Anexo IV.","Conditions of the Marketing Authorisation are set out in Annex IV.",11,13
"2299","es","en","Las diferencias fueron estadísticamente significativas (diferencia -0,7%, IC95% -0,80; -0,5, p < au","Differences were statistically significant (Difference -0.7%, CI95% -0.80; -0.5, p < 0.001).",12,13
"2300","es","en","Las directrices publicadas para consulta en 1996 son las siguientes:","Guidelines released for consultation in 1996 include:",7,10
"2301","es","en","Las dos vacunas deberán administrarse como inyecciones separadas en diferentes sitios del cuerpo.","The two vaccines should be given as separate injections at different body sites.",13,13
"2302","es","en","Las dosis altas pueden causar parálisis en los músculos distantes al punto de inyección.","Large doses may cause paralysis in muscles distant to the injection site.",12,14
"2303","es","en","Las dosis recomendadas son las que se indican a continuación.","The recommended doses are given below.",6,10
"2304","es","en","Las dosis siguientes deben administrarse mensualmente durante la estación del VRS.","Subsequent doses should be administered monthly throughout the RSV season.",10,11
"2305","es","en","Las dosis superiores a 10 μ g dos veces al día no están recomendadas.","Doses higher than 10µg BID are not recommended.",8,14
"2306","es","en","Las enfermedades concomitantes, especialmente las infecciones, suelen aumentar la necesidad de insulina del paciente.","Concomitant illness, especially infections, usually increases the patient’ s insulin requirements.",11,14
"2307","es","en","Las frecuencias de las reacciones adversas se expresan en pacientes-año, de acuerdo con las siguientes categorías:","The frequencies of adverse reactions are expressed in patient-years, according to the following categories:",14,16
"2308","es","en","Las frecuencias están basadas en los datos de los ensayos clínicos.","The incidences are based on clinical trial data.",8,11
"2309","es","en","Las frecuencias se definen como frecuentes (≥ 1/ 100, < 1/ 10).","Frequencies are defined as common (≥ 1/ 100, < 1/ 10).",11,12
"2310","es","en","Las instrucciones de uso de la pluma de insulina se proporcionan con su pluma de insulina.","The instructions for using the insulin pen are provided with your insulin pen.",13,16
"2311","es","en","Las instrucciones para el uso adecuado de Keppra se proporcionan en la sección 3.","Direction for the proper use of Keppra is provided in section 3.",12,14
"2312","es","en","Las instrucciones para la autoadministración se mencionan en el prospecto del producto.","Instruction for self-administration is mentioned in the Package Leaflet.",9,12
"2313","es","en","Las jeringas contienen 0,7 ml (7000 UI) de solución.","The syringes contain 0.7 ml (7000 IU) of solution.",9,9
"2314","es","en","Las jeringas para inyección no deben contener ningún otro principio activo ni residuo (p. ej., trazas de heparina).","The injection syringes must not contain any other medicinal product or residue (e. g. traces of heparin).",17,18
"2315","es","en","Las lesiones de la piel son complicaciones frecuentes de la diabetes.","Diabetic skin lesions are a common complication of diabetes.",9,11
"2316","es","en","Las listas de expertos europeos están disponibles para su inspección previa petición a las oficinas de la EMEA.","European experts lists The list of European experts is available for examination on request at the EMEA offices.",18,18
"2317","es","en","Las mujeres con posibilidad de quedar embarazadas deben adoptar medidas anticonceptivas eficaces.","Effective contraceptive measures must be taken by women of child-bearing potential.",11,12
"2318","es","en","Las mujeres en edad de riesgo de embarazo tienen que utilizar medidas anticonceptivas eficaces durante el tratamiento.","Women of childbearing potential have to use effective contraception during treatment.",11,17
"2319","es","en","Las mujeres que reciban Myocet, no deben amamantar.","Women receiving Myocet should not breastfeed.",6,8
"2320","es","en","Las mutaciones V82A, I54V y M46I fueron las que aparecieron con mayor frecuencia.","Cholecystitis, hepatitis, hepatomegaly, liver fatty deposit, liver tenderness",8,13
"2321","es","en","Las otras 2 dosis se administrarán 7 y 21 días después de la primera dosis.","The remaining 2 doses will be given 7 days and 21 days after the first dose.",16,15
"2322","es","en","Las pacientes que han interrumpido su tratamiento por reacciones de hipersensibilidad no deben re-iniciar el tratamiento con PROTELOS.","Patients who have stopped treatment due to hypersensitivity reactions should not re-start therapy with PROTELOS.",15,18
"2323","es","en","Las personas con hipersensibilidad (alergia) conocida al meloxicam deberán evitar el contacto con el medicamento.","People with known hypersensitivity (allergic) to meloxicam should avoid contact with the product.",13,15
"2324","es","en","Las personas inmunocomprometidas/ inmunosuprimidas no pueden ser autorizadas a manipular esta vacuna.","Immunocompromised/ immunosuppressed individuals must not be allowed to handle this vaccine.",11,12
"2325","es","en","Las personas que manipulen y distribuyan esta vacuna deben ser vacunadas contra la rabia.","People handling and distributing this vaccine should be vaccinated against rabies.",11,14
"2326","es","en","Las plumas en uso no deben guardarse en la nevera.","Pens in use must not be stored in the refrigerator.",10,10
"2327","es","en","Las plumas vacías no deben rellenarse y se deben desechar de forma segura.","Empty pens must not be re-filled and must be properly discarded.",11,13
"2328","es","en","Las prioridades para 2001-2002 son:","the whole process for product information.",6,5
"2329","es","en","Las propuestas son aceptables, con algunas mejoras.","The proposals are acceptable with some improvements.",7,7
"2330","es","en","Las pruebas de seguimiento de inhibidores en este paciente tras abandonar el ensayo fueron negativas.","Follow-up inhibitor tests in this patient after withdrawal from the study were negative.",13,15
"2331","es","en","Las RA fueron de intensidad leve y fueron valoradas como reacciones asociadas a la perfusión.","The ADRs were mild in intensity and assessed as an IAR.",11,15
"2332","es","en","Las RAMs en cuanto a su gravedad fueron en su mayoría leves o moderadas:","ADRs were mostly mild to moderate in severity:",8,14
"2333","es","en","Las reacciones adversas (RAs) notificadas con más frecuencia (incidencia ≥ 1/ 10) son:","The most frequently reported adverse drug reactions (ADRs) (incidence ≥ 1/ 10) are:",13,13
"2334","es","en","Las reacciones adversas a nivel del sistema nervioso aparecen en aproximadamente el 40% de los pacientes.","Nervous system undesirable effects occur in approximately 40% of patients.",10,16
"2335","es","en","Las reacciones adversas fueron normalmente de leve a moderadas y aparecieron en las dos primeras semanas de tratamiento.","Adverse reactions were usually mild or moderate and occurred within the first two weeks of treatment.",16,18
"2336","es","en","Las reacciones adversas más frecuentes se detallan en la sección 4.8.","The most commonly reported reactions are listed in section 4.8.",10,11
"2337","es","en","Las reacciones adversas más relevantes asociadas a efavirenz son erupción y síntomas del sistema nervioso (ver sección 4.4).","The most notable adverse reactions associated with efavirenz are rash and nervous system symptoms (see section 4.4).",17,18
"2338","es","en","Las reacciones adversas se citan según la frecuencia absoluta y clasificación por órganos y sistemas de MedDRA.","Adverse reactions are listed by MedDRA system organ class and absolute frequency.",12,17
"2339","es","en","Las reacciones adversas se enumeran en orden decreciente de gravedad dentro de cada intervalo de frecuencia.","Within each frequency grouping, undesirable effects are presented in order of decreasing seriousness.",13,16
"2340","es","en","Las reacciones adversas se presentan en orden decreciente de gravedad dentro de cada intervalo de frecuencia.","Within each frequency grouping, adverse reactions are ranked in order of decreasing seriousness.",13,16
"2341","es","en","Las reacciones alérgicas a estas sustancias pueden ser graves en ciertos casos.","Allergic reactions to these substances may occasionally be serious.",9,12
"2342","es","en","Las reacciones asociadas con la perfusión consistieron sobre todo en fiebre y escalofríos.","Infusion associated reactions consisted most often of fever and chills.",10,13
"2343","es","en","Las reacciones de frecuencia no conocida notificadas con la administración de telmisartán sólo incluyen:","Adverse reactions of unknown frequency reported with the use of telmisartan alone include:",13,14
"2344","es","en","Las reacciones normalmente desaparecen en unos pocos días eincluso semanas.","Reactions usually resolve in a few days to a few weeks.",11,10
"2345","es","en","Las recomendaciones en cuanto a dosis son las mismas que las de los adultos tratados con quimioterapia.","The dose recommendations are the same as those for adults receiving chemotherapy.",12,17
